tweet_id,source,text,image_urls,name,date,time,dog_stage,favorite_count,retweet_count,rating_numerator,rating_denominator,rating_percentage
891815181378084864,iPhone Twitter,This is Archie. He is a rare Norwegian Pouncing Corgo. Lives in the tall grass. You never know when one may strike. 12/10 https://t.co/wUnZnhtVJB,https://twitter.com/dog_rates/status/891815181378084864/photo/1,Archie,2017-07-31,00:18:03,,24383,4017,12.0,10.0,120.0
891689557279858688,iPhone Twitter,This is Darla. She commenced a snooze mid meal. 13/10 happens to the best of us https://t.co/tD36da7qLQ,https://twitter.com/dog_rates/status/891689557279858688/photo/1,Darla,2017-07-30,15:58:51,,41019,8370,13.0,10.0,130.0
891327558926688256,iPhone Twitter,"This is Franklin. He would like you to stop calling him ""cute."" He is a very fierce shark and should be respected as such. 12/10 #BarkWeek https://t.co/AtUZn91f7f","https://twitter.com/dog_rates/status/891327558926688256/photo/1,https://twitter.com/dog_rates/status/891327558926688256/photo/1",Franklin,2017-07-29,16:00:24,,39207,9074,12.0,10.0,120.0
891087950875897856,iPhone Twitter,Here we have a majestic great white breaching off South Africa's coast. Absolutely h*ckin breathtaking. 13/10 (IG: tucker_marlo) #BarkWeek https://t.co/kQ04fDDRmh,https://twitter.com/dog_rates/status/891087950875897856/photo/1,,2017-07-29,00:08:17,,19714,3010,13.0,10.0,130.0
890729181411237888,iPhone Twitter,When you watch your owner call another dog a good boy but then they turn back to you and say you're a great boy. 13/10 https://t.co/v0nONBcwxq,"https://twitter.com/dog_rates/status/890729181411237888/photo/1,https://twitter.com/dog_rates/status/890729181411237888/photo/1",,2017-07-28,00:22:40,,63589,18253,13.0,10.0,130.0
890609185150312448,iPhone Twitter,This is Zoey. She doesn't want to be one of the scary sharks. Just wants to be a snuggly pettable boatpet. 13/10 #BarkWeek https://t.co/9TwLuAGH0b,https://twitter.com/dog_rates/status/890609185150312448/photo/1,Zoey,2017-07-27,16:25:51,,27097,4133,13.0,10.0,130.0
890006608113172480,iPhone Twitter,This is Koda. He is a South Australian deckshark. Deceptively deadly. Frighteningly majestic. 13/10 would risk a petting #BarkWeek https://t.co/dVPW0B0Mme,"https://twitter.com/dog_rates/status/890006608113172480/photo/1,https://twitter.com/dog_rates/status/890006608113172480/photo/1",Koda,2017-07-26,00:31:25,,29884,7093,13.0,10.0,130.0
889638837579907072,iPhone Twitter,This is Ted. He does his best. Sometimes that's not enough. But it's ok. 12/10 would assist https://t.co/f8dEDcrKSR,"https://twitter.com/dog_rates/status/889638837579907072/photo/1,https://twitter.com/dog_rates/status/889638837579907072/photo/1",Ted,2017-07-25,00:10:02,,26408,4384,12.0,10.0,120.0
889278841981685760,iPhone Twitter,This is Oliver. You're witnessing one of his many brutal attacks. Seems to be playing with his victim. 13/10 fr*ckin frightening #BarkWeek https://t.co/WpHvrQedPb,https://twitter.com/dog_rates/status/889278841981685760/video/1,Oliver,2017-07-24,00:19:32,,24581,5201,13.0,10.0,130.0
888917238123831296,iPhone Twitter,This is Jim. He found a fren. Taught him how to sit like the good boys. 12/10 for both https://t.co/chxruIOUJN,https://twitter.com/dog_rates/status/888917238123831296/photo/1,Jim,2017-07-23,00:22:39,,28365,4359,12.0,10.0,120.0
888554962724278272,iPhone Twitter,This is Ralphus. He's powering up. Attempting maximum borkdrive. 13/10 inspirational af https://t.co/YnYAFCTTiK,"https://twitter.com/dog_rates/status/888554962724278272/photo/1,https://twitter.com/dog_rates/status/888554962724278272/photo/1,https://twitter.com/dog_rates/status/888554962724278272/photo/1,https://twitter.com/dog_rates/status/888554962724278272/photo/1",Ralphus,2017-07-22,00:23:06,,19313,3422,13.0,10.0,130.0
888078434458587136,iPhone Twitter,This is Gerald. He was just told he didn't get the job he interviewed for. A h*ckin injustice. 12/10 didn't want the job anyway https://t.co/DK7iDPfuRX,"https://twitter.com/dog_rates/status/888078434458587136/photo/1,https://twitter.com/dog_rates/status/888078434458587136/photo/1",Gerald,2017-07-20,16:49:33,,21186,3375,12.0,10.0,120.0
887705289381826560,iPhone Twitter,This is Jeffrey. He has a monopoly on the pool noodles. Currently running a 'boop for two' midweek sale. 13/10 h*ckin strategic https://t.co/PhrUk20Q64,https://twitter.com/dog_rates/status/887705289381826560/photo/1,Jeffrey,2017-07-19,16:06:48,,29412,5210,13.0,10.0,130.0
887517139158093824,iPhone Twitter,I've yet to rate a Venezuelan Hover Wiener. This is such an honor. 14/10 paw-inspiring af (IG: roxy.thedoxy) https://t.co/20VrLAA8ba,https://twitter.com/dog_rates/status/887517139158093824/video/1,,2017-07-19,03:39:09,,45073,11328,14.0,10.0,140.0
887343217045368832,iPhone Twitter,You may not have known you needed to see this today. 13/10 please enjoy (IG: emmylouroo) https://t.co/WZqNqygEyV,https://twitter.com/dog_rates/status/887343217045368832/video/1,,2017-07-18,16:08:03,,32797,10097,13.0,10.0,130.0
887101392804085760,iPhone Twitter,This... is a Jubilant Antarctic House Bear. We only rate dogs. Please only send dogs. Thank you... 12/10 would suffocate in floof https://t.co/4Ad1jzJSdp,https://twitter.com/dog_rates/status/887101392804085760/photo/1,,2017-07-18,00:07:08,,29782,5771,12.0,10.0,120.0
886983233522544640,iPhone Twitter,This is Maya. She's very shy. Rarely leaves her cup. 13/10 would find her an environment to thrive in https://t.co/I6oNy0CgiT,"https://twitter.com/dog_rates/status/886983233522544640/photo/1,https://twitter.com/dog_rates/status/886983233522544640/photo/1",Maya,2017-07-17,16:17:36,,34206,7522,13.0,10.0,130.0
886736880519319552,iPhone Twitter,"This is Mingus. He's a wonderful father to his smol pup. Confirmed 13/10, but he needs your help

https://t.co/bVi0Yr4Cff https://t.co/ISvKOSkd5b","https://www.gofundme.com/mingusneedsus,https://twitter.com/dog_rates/status/886736880519319552/photo/1,https://twitter.com/dog_rates/status/886736880519319552/photo/1",Mingus,2017-07-16,23:58:41,,11733,3164,13.0,10.0,130.0
886680336477933568,iPhone Twitter,This is Derek. He's late for a dog meeting. 13/10 pet...al to the metal https://t.co/BCoWue0abA,https://twitter.com/dog_rates/status/886680336477933568/photo/1,Derek,2017-07-16,20:14:00,,21855,4321,13.0,10.0,130.0
886366144734445568,iPhone Twitter,This is Roscoe. Another pupper fallen victim to spontaneous tongue ejections. Get the BlepiPen immediate. 12/10 deep breaths Roscoe https://t.co/RGE08MIJox,"https://twitter.com/dog_rates/status/886366144734445568/photo/1,https://twitter.com/dog_rates/status/886366144734445568/photo/1",Roscoe,2017-07-15,23:25:31,pupper,20637,3098,12.0,10.0,120.0
885984800019947520,iPhone Twitter,Viewer discretion advised. This is Jimbo. He will rip ur finger right h*ckin off. Other dog clearly an accessory. 12/10 pls pet with caution https://t.co/BuveP0uMF1,https://twitter.com/dog_rates/status/885984800019947520/photo/1,Jimbo,2017-07-14,22:10:11,,31765,6559,12.0,10.0,120.0
885528943205470208,iPhone Twitter,This is Maisey. She fell asleep mid-excavation. Happens to the best of us. 13/10 would pat noggin approvingly https://t.co/tp1kQ8i9JF,https://twitter.com/dog_rates/status/885528943205470208/photo/1,Maisey,2017-07-13,15:58:47,,35042,6222,13.0,10.0,130.0
885167619883638784,iPhone Twitter,Here we have a corgi undercover as a malamute. Pawbably doing important investigative work. Zero control over tongue happenings. 13/10 https://t.co/44ItaMubBf,"https://twitter.com/dog_rates/status/885167619883638784/photo/1,https://twitter.com/dog_rates/status/885167619883638784/photo/1,https://twitter.com/dog_rates/status/885167619883638784/photo/1,https://twitter.com/dog_rates/status/885167619883638784/photo/1",,2017-07-12,16:03:00,,21346,4247,13.0,10.0,130.0
884562892145688576,iPhone Twitter,This is Kevin. He's just so happy. 13/10 what is your secret Kevin https://t.co/1r4MFCbCX5,https://twitter.com/dog_rates/status/884562892145688576/photo/1,Kevin,2017-07-11,00:00:02,,23647,4542,13.0,10.0,130.0
884441805382717440,iPhone Twitter,"I present to you, Pup in Hat. Pup in Hat is great for all occasions. Extremely versatile. Compact as h*ck. 14/10 (IG: itselizabethgales) https://t.co/vvBOcC2VdC",https://twitter.com/dog_rates/status/884441805382717440/photo/1,,2017-07-10,15:58:53,,26308,5486,14.0,10.0,140.0
884247878851493888,iPhone Twitter,OMG HE DIDN'T MEAN TO HE WAS JUST TRYING A LITTLE BARKOUR HE'S SUPER SORRY 13/10 WOULD FORGIVE IMMEDIATE https://t.co/uF3pQ8Wubj,https://twitter.com/kaijohnson_19/status/883965650754039809,,2017-07-10,03:08:17,,71025,19875,13.0,10.0,130.0
883482846933004288,iPhone Twitter,"This is Bella. She hopes her smile made you smile. If not, she is also offering you her favorite monkey. 13.5/10 https://t.co/qjrljjt948","https://twitter.com/dog_rates/status/883482846933004288/photo/1,https://twitter.com/dog_rates/status/883482846933004288/photo/1",Bella,2017-07-08,00:28:19,,44724,9623,13.5,10.0,135.0
883117836046086144,iPhone Twitter,"Please only send dogs. We don't rate mechanics, no matter how h*ckin good. Thank you... 13/10 would sneak a pat https://t.co/Se5fZ9wp5E","https://twitter.com/dog_rates/status/883117836046086144/photo/1,https://twitter.com/dog_rates/status/883117836046086144/photo/1",,2017-07-07,00:17:54,,36181,6456,13.0,10.0,130.0
882992080364220416,iPhone Twitter,This is Rusty. He wasn't ready for the first pic. Clearly puppared for the second. 13/10 confirmed great boy https://t.co/tyER0KpdXj,"https://twitter.com/dog_rates/status/882992080364220416/photo/1,https://twitter.com/dog_rates/status/882992080364220416/photo/1",Rusty,2017-07-06,15:58:11,,23322,3804,13.0,10.0,130.0
882762694511734784,iPhone Twitter,This is Gus. He's quite the cheeky pupper. Already perfected the disinterested wink. 12/10 would let steal my girl https://t.co/D43I96SlVu,https://twitter.com/dog_rates/status/882762694511734784/photo/1,Gus,2017-07-06,00:46:41,pupper,27568,4749,12.0,10.0,120.0
882627270321602560,iPhone Twitter,This is Stanley. He has his first swim lesson today. Doggle straps adjusted. Ready to go. 13/10 Phelps is nervous (IG: stanleythe_corgi) https://t.co/Nx52PGwH94,https://twitter.com/dog_rates/status/882627270321602560/photo/1,Stanley,2017-07-05,15:48:34,,27209,5908,13.0,10.0,130.0
882268110199369728,iPhone Twitter,This is Alfy. You're witnessing his first watermelon experience. I think it was a success. 13/10 happy 4th Alfy ðŸ‡ºðŸ‡¸ https://t.co/fYP5RlutfA,"https://twitter.com/dog_rates/status/882268110199369728/photo/1,https://twitter.com/dog_rates/status/882268110199369728/photo/1,https://twitter.com/dog_rates/status/882268110199369728/photo/1",Alfy,2017-07-04,16:01:23,,43761,11239,13.0,10.0,130.0
881666595344535552,iPhone Twitter,This is Gary. He couldn't miss this puppertunity for a selfie. Flawless focusing skills. 13/10 would boop intensely https://t.co/7CSWCl8I6s,https://twitter.com/dog_rates/status/881666595344535552/photo/1,Gary,2017-07-03,00:11:11,,49293,10357,13.0,10.0,130.0
881268444196462592,iPhone Twitter,Meet Elliot. He's a Canadian Forrest Pup. Unusual number of antlers for a dog. Sneaky tongue slip to celebrate #Canada150. 12/10 would pet https://t.co/cgwJwowTMC,https://twitter.com/dog_rates/status/881268444196462592/photo/1,Elliot,2017-07-01,21:49:04,,22525,5029,12.0,10.0,120.0
880872448815771648,iPhone Twitter,Ugh not again. We only rate dogs. Please don't send in well-dressed  floppy-tongued street penguins. Dogs only please. Thank you... 12/10 https://t.co/WiAMbTkDPf,https://twitter.com/dog_rates/status/880872448815771648/photo/1,,2017-06-30,19:35:32,,20718,3713,12.0,10.0,120.0
880465832366813184,iPhone Twitter,This is Bella. She had her first beach experience this morning. Complete success. 12/10 would perform a sandy boop https://t.co/4VsFysDmiw,"https://twitter.com/dog_rates/status/880465832366813184/photo/1,https://twitter.com/dog_rates/status/880465832366813184/photo/1,https://twitter.com/dog_rates/status/880465832366813184/photo/1,https://twitter.com/dog_rates/status/880465832366813184/photo/1",Bella,2017-06-29,16:39:47,,27796,6093,12.0,10.0,120.0
880221127280381952,iPhone Twitter,Meet Jesse. He's a Fetty Woof. His tongue ejects without warning. A true bleptomaniac. 12/10 would snug well https://t.co/fUod0tVmvK,"https://twitter.com/dog_rates/status/880221127280381952/photo/1,https://twitter.com/dog_rates/status/880221127280381952/photo/1",Jesse,2017-06-29,00:27:25,,26335,4092,12.0,10.0,120.0
879862464715927552,iPhone Twitter,This is Romeo. He would like to do an entrance. Requesting your immediate assistance. 13/10 https://t.co/Qh5aEkRQm9,"https://twitter.com/dog_rates/status/879862464715927552/photo/1,https://twitter.com/dog_rates/status/879862464715927552/photo/1,https://twitter.com/dog_rates/status/879862464715927552/photo/1",Romeo,2017-06-28,00:42:13,,21778,3392,13.0,10.0,130.0
879492040517615616,iPhone Twitter,This is Bailey. He thinks you should measure ear length for signs of growth instead. 12/10 https://t.co/IxM9IMKQq8,https://twitter.com/dog_rates/status/879492040517615616/photo/1,Bailey,2017-06-27,00:10:17,,22841,3085,12.0,10.0,120.0
879376492567855104,iPhone Twitter,This is Jack AKA Stephen Furry. You're not scoring on him. Unless he slips down the slide. 12/10 would happily get blocked by https://t.co/0gOi601EAa,https://twitter.com/dog_rates/status/879376492567855104/photo/1,Jack,2017-06-26,16:31:08,,16383,3021,12.0,10.0,120.0
879050749262655488,iPhone Twitter,This is Steven. He has trouble relating to other dogs. Quite shy. Neck longer than average. Tropical probably. 11/10 would still pet https://t.co/2mJCDEJWdD,https://twitter.com/dog_rates/status/879050749262655488/photo/1,Steven,2017-06-25,18:56:45,,21975,4567,11.0,10.0,110.00000000000001
878281511006478336,iPhone Twitter,"Meet Shadow. In an attempt to reach maximum zooming borkdrive, he tore his ACL. Still 13/10 tho. Help him out below

https://t.co/245xJJElsY https://t.co/lUiQH219v6","https://www.gofundme.com/3yd6y1c,https://twitter.com/dog_rates/status/878281511006478336/photo/1",Shadow,2017-06-23,16:00:04,,7548,1250,13.0,10.0,130.0
878057613040115712,iPhone Twitter,This is Emmy. She was adopted today. Massive round of pupplause for Emmy and her new family. 14/10 for all involved https://t.co/cwtWnHMVpe,"https://twitter.com/dog_rates/status/878057613040115712/photo/1,https://twitter.com/dog_rates/status/878057613040115712/photo/1",Emmy,2017-06-23,01:10:23,,40990,6618,14.0,10.0,140.0
877736472329191424,iPhone Twitter,This is Aja. She was just told she's a good dog. Suspicions confirmed. 13/10 would tell again https://t.co/lsPyyAiF1r,"https://twitter.com/dog_rates/status/877736472329191424/photo/1,https://twitter.com/dog_rates/status/877736472329191424/photo/1",Aja,2017-06-22,03:54:17,,77732,18550,13.0,10.0,130.0
877556246731214848,iPhone Twitter,This is Penny. She's both pupset and fired pup. Not pleased w your barbaric attempts at cleanliness. 12/10 would enjoy more shampoo options https://t.co/OYdDlfOGXP,https://twitter.com/dog_rates/status/877556246731214848/photo/1,Penny,2017-06-21,15:58:08,,22171,3694,12.0,10.0,120.0
877201837425926144,iPhone Twitter,This is Nelly. He graduated with his dogtorate today. Wants to know if you're proud of him. 12/10 would give congratulatory boop https://t.co/4g4cfj3P4Y,"https://twitter.com/dog_rates/status/877201837425926144/photo/1,https://twitter.com/dog_rates/status/877201837425926144/photo/1",Nelly,2017-06-20,16:29:50,,26464,5433,12.0,10.0,120.0
876838120628539392,iPhone Twitter,This is Ginger. She's having a ruff Monday. Too many pupper things going on. H*ckin exhausting. 12/10 would snug passionately https://t.co/j211oCDRs6,"https://twitter.com/dog_rates/status/876838120628539392/photo/1,https://twitter.com/dog_rates/status/876838120628539392/photo/1",Ginger,2017-06-19,16:24:33,pupper,20185,3248,12.0,10.0,120.0
876484053909872640,iPhone Twitter,This is Benedict. He wants to thank you for this delightful urban walk. Hopes you know he loves you. 13/10 super duper good boy https://t.co/26BXueUgbs,https://twitter.com/dog_rates/status/876484053909872640/photo/1,Benedict,2017-06-18,16:57:37,,18311,2326,13.0,10.0,130.0
876120275196170240,iPhone Twitter,"Meet Venti, a seemingly caffeinated puppoccino. She was just informed the weekend would include walks, pats and scritches. 13/10 much excite https://t.co/ejExJFq3ek",https://twitter.com/dog_rates/status/876120275196170240/photo/1,Venti,2017-06-17,16:52:05,,27268,4559,13.0,10.0,130.0
875747767867523072,iPhone Twitter,"This is Goose. He's a womanizer. Cheeky as h*ck, but also deep. Tongue slip game on another level. 13/10 will steal your girl https://t.co/V2WlACRJCN",https://twitter.com/dog_rates/status/875747767867523072/photo/1,Goose,2017-06-16,16:11:53,,24586,4175,13.0,10.0,130.0
875144289856114688,iPhone Twitter,Meet Nugget and Hank. Nugget took Hank's bone. Hank is wondering if you would please return it to him. Both 13/10 would not intervene https://t.co/ogith9ejNj,https://twitter.com/dog_rates/status/875144289856114688/video/1,Nugget,2017-06-15,00:13:52,,21416,4812,13.0,10.0,130.0
875097192612077568,iPhone Twitter,You'll get your package when that precious man is done appreciating the pups. 13/10 for everyone https://t.co/PFp4MghzBW,https://twitter.com/drboondoc/status/874413398133547008,,2017-06-14,21:06:43,,26751,5899,13.0,10.0,130.0
875021211251597312,iPhone Twitter,Guys please stop sending pictures without any dogs in th- oh never mind hello excuse me sir. 12/10 stealthy as h*ck https://t.co/brCQoqc8AW,"https://twitter.com/dog_rates/status/875021211251597312/photo/1,https://twitter.com/dog_rates/status/875021211251597312/photo/1",,2017-06-14,16:04:48,,24885,4605,12.0,10.0,120.0
874680097055178752,iPhone Twitter,Meet Cash. He hath acquired a stick. A very good stick tbh. 12/10 would pat head approvingly https://t.co/lZhtizkURD,https://twitter.com/dog_rates/status/874680097055178752/photo/1,Cash,2017-06-13,17:29:20,,27183,4529,12.0,10.0,120.0
874296783580663808,iPhone Twitter,This is Jed. He may be the fanciest pupper in the game right now. Knows it too. 13/10 would sign modeling contract https://t.co/0YplNnSMEm,https://twitter.com/dog_rates/status/874296783580663808/photo/1,Jed,2017-06-12,16:06:11,pupper,25460,4011,13.0,10.0,130.0
874057562936811520,iPhone Twitter,"I can't believe this keeps happening. This, is a birb taking a bath. We only rate dogs. Please only send dogs. Thank you... 12/10 https://t.co/pwY9PQhtP2",https://twitter.com/dog_rates/status/874057562936811520/photo/1,,2017-06-12,00:15:36,,22191,3856,12.0,10.0,120.0
874012996292530176,iPhone Twitter,"This is Sebastian. He can't see all the colors of the rainbow, but he can see that this flag makes his human happy. 13/10 #PrideMonth puppo https://t.co/XBE0evJZ6V","https://twitter.com/dog_rates/status/874012996292530176/photo/1,https://twitter.com/dog_rates/status/874012996292530176/photo/1",Sebastian,2017-06-11,21:18:31,puppo,33751,10162,13.0,10.0,130.0
873213775632977920,iPhone Twitter,"This is Sierra. She's one precious pupper. Absolute 12/10. Been in and out of ICU her whole life. Help Sierra below

https://t.co/Xp01EU3qyD https://t.co/V5lkvrGLdQ","https://www.gofundme.com/help-my-baby-sierra-get-better,https://twitter.com/dog_rates/status/873213775632977920/photo/1,https://twitter.com/dog_rates/status/873213775632977920/photo/1",Sierra,2017-06-09,16:22:42,pupper,7073,1549,12.0,10.0,120.0
872967104147763200,iPhone Twitter,Here's a very large dog. He has a date later. Politely asked this water person to check if his breath is bad. 12/10 good to go doggo https://t.co/EMYIdoblMR,"https://twitter.com/dog_rates/status/872967104147763200/photo/1,https://twitter.com/dog_rates/status/872967104147763200/photo/1",,2017-06-09,00:02:31,doggo,26732,5288,12.0,10.0,120.0
872820683541237760,iPhone Twitter,"Here are my favorite #dogsatpollingstations 
Most voted for a more consistent walking schedule and to increase daily pats tenfold. All 13/10 https://t.co/17FVMl4VZ5","https://twitter.com/dog_rates/status/872820683541237760/photo/1,https://twitter.com/dog_rates/status/872820683541237760/photo/1,https://twitter.com/dog_rates/status/872820683541237760/photo/1,https://twitter.com/dog_rates/status/872820683541237760/photo/1",,2017-06-08,14:20:41,,14415,3620,13.0,10.0,130.0
872620804844003328,iPhone Twitter,This is Monkey. She's supporting owners everywhere with her fancy #PrideMonth bandana. 13/10 love is love is love... https://t.co/lUcpnZDPz9,https://twitter.com/dog_rates/status/872620804844003328/photo/1,Monkey,2017-06-08,01:06:27,,20339,3617,13.0,10.0,130.0
872486979161796608,iPhone Twitter,We. Only. Rate. Dogs. Do not send in other things like this fluffy floor shark clearly ready to attack. Get it together guys... 12/10 https://t.co/BZHiKx3FpQ,https://twitter.com/dog_rates/status/872486979161796608/photo/1,,2017-06-07,16:14:40,,39840,8838,12.0,10.0,120.0
871102520638267392,iPhone Twitter,Never doubt a doggo 14/10 https://t.co/AbBLh2FZCH,https://twitter.com/animalcog/status/871075758080503809,,2017-06-03,20:33:19,doggo,20545,5412,14.0,10.0,140.0
870804317367881728,iPhone Twitter,Real funny guys. Sending in a pic without a dog in it. Hilarious. We'll rate the rug tho because it's giving off a very good vibe. 11/10 https://t.co/GCD1JccCyi,https://twitter.com/dog_rates/status/870804317367881728/photo/1,,2017-06-03,00:48:22,,33003,6102,11.0,10.0,110.00000000000001
870374049280663552,iPhone Twitter,This is Zoey. She really likes the planet. Would hate to see willful ignorance and the denial of fairly elemental science destroy it. 13/10 https://t.co/T1xlgaPujm,https://twitter.com/dog_rates/status/870374049280663552/photo/1,Zoey,2017-06-01,20:18:38,,81311,25842,13.0,10.0,130.0
869772420881756160,iPhone Twitter,"This is Dewey (pronounced ""covfefe""). He's having a good walk. Arguably the best walk. 13/10 would snug softly https://t.co/HciEaJkC4D",https://twitter.com/dog_rates/status/869772420881756160/photo/1,Dewey,2017-05-31,04:27:59,,41742,9902,13.0,10.0,130.0
869227993411051520,iPhone Twitter,This is Gizmo. His favorite thing is standing pupright like a hooman. Sneaky tongue slip status achieved. 13/10 would boop well https://t.co/IoR3n1fiiQ,https://twitter.com/dog_rates/status/869227993411051520/photo/1,Gizmo,2017-05-29,16:24:37,,20161,3750,13.0,10.0,130.0
868622495443632128,iPhone Twitter,Here's a h*ckin peaceful boy. Unbothered by the comings and goings. 13/10 please reveal your wise ways https://t.co/yeaH8Ej5eM,https://twitter.com/dog_rates/status/868622495443632128/photo/1,,2017-05-28,00:18:35,,26361,5240,13.0,10.0,130.0
868552278524837888,iPhone Twitter,"Say hello to Cooper. His expression is the same wet or dry. Absolute 12/10 but Coop desperately requests your help

https://t.co/ZMTE4Mr69f https://t.co/7RyeXTYLNi","https://www.gofundme.com/3ti3nps,https://twitter.com/dog_rates/status/868552278524837888/photo/1,https://twitter.com/dog_rates/status/868552278524837888/photo/1",Cooper,2017-05-27,19:39:34,,9983,2069,12.0,10.0,120.0
867900495410671616,iPhone Twitter,"Unbelievable. We only rate dogs. Please don't send in non-canines like the ""I"" from Pixar's opening credits. Thank you... 12/10 https://t.co/JMhDNv5wXZ",https://twitter.com/dog_rates/status/867900495410671616/photo/1,,2017-05-26,00:29:37,,23865,4136,12.0,10.0,120.0
867051520902168576,iPhone Twitter,"Oh my this spooked me up. We only rate dogs, not happy ghosts. Please send dogs only. It's a very simple premise. Thank you... 13/10 https://t.co/M5Rz0R8SIQ",https://twitter.com/dog_rates/status/867051520902168576/photo/1,,2017-05-23,16:16:06,,31862,7796,13.0,10.0,130.0
866686824827068416,iPhone Twitter,This is Lili. She can't believe you betrayed her with bath time. Never looking you in the eye again. 12/10 would puppologize profusely https://t.co/9b9J46E86Z,"https://twitter.com/dog_rates/status/866686824827068416/photo/1,https://twitter.com/dog_rates/status/866686824827068416/photo/1",Lili,2017-05-22,16:06:55,,19063,3452,12.0,10.0,120.0
865718153858494464,iPhone Twitter,"Meet Boomer. He's just checking pup on you. Hopes you had a good day. If not, he hopes he made it better. 13/10 extremely good boy https://t.co/pozUoHLkGg",https://twitter.com/dog_rates/status/865718153858494464/photo/1,Boomer,2017-05-19,23:57:46,,25387,5589,13.0,10.0,130.0
865359393868664832,iPhone Twitter,This is Sammy. Her tongue ejects without warning sometimes. It's a serious condition. Needs a hefty dose from a BlepiPen. 13/10 https://t.co/g20EmqK7vc,"https://twitter.com/dog_rates/status/865359393868664832/photo/1,https://twitter.com/dog_rates/status/865359393868664832/photo/1",Sammy,2017-05-19,00:12:11,,26206,4980,13.0,10.0,130.0
865006731092295680,iPhone Twitter,This is Nelly. He really hopes you like his Hawaiian shirt. He already tore the tags off. 13/10 h*ck of a puppurchase https://t.co/LbkG5CiM7o,https://twitter.com/dog_rates/status/865006731092295680/photo/1,Nelly,2017-05-18,00:50:50,,27752,7658,13.0,10.0,130.0
864873206498414592,iPhone Twitter,We only rate dogs. Please don't send in Jesus. We're trying to remain professional and legitimate. Thank you... 14/10 https://t.co/wr3xsjeCIR,"https://twitter.com/dog_rates/status/864873206498414592/photo/1,https://twitter.com/dog_rates/status/864873206498414592/photo/1",,2017-05-17,16:00:15,,31996,8685,14.0,10.0,140.0
864279568663928832,iPhone Twitter,This is Meatball. He doing what's known in the industry as a mid-strut mlem. H*ckin fancy boy. 12/10 I'd do anything for Meatball https://t.co/S2HdmFFPck,"https://twitter.com/dog_rates/status/864279568663928832/photo/1,https://twitter.com/dog_rates/status/864279568663928832/photo/1",Meatball,2017-05-16,00:41:21,,14503,3016,12.0,10.0,120.0
