tweet_id,source,text,image_urls,name,date,time,dog_stage,favorite_count,retweet_count,rating_numerator,rating_denominator,rating_percentage
682032003584274432,iPhone Twitter,This is Ulysses. He likes holding hands and his eyes are magic. 11/10 https://t.co/gPmJHmtgak,https://twitter.com/dog_rates/status/682032003584274432/photo/1,Ulysses,2015-12-30,02:54:35,,6839,2131,11.0,10.0,110.00000000000001
682003177596559360,iPhone Twitter,Unique dog here. Wrinkly as hell. Weird segmented neck. Finger on fire. Doesn't seem to notice. 5/10 might still pet https://t.co/Hy9La4xNX3,https://twitter.com/dog_rates/status/682003177596559360/photo/1,,2015-12-30,01:00:03,,3278,1624,5.0,10.0,50.0
681981167097122816,iPhone Twitter,This is Jimothy. He's a Trinidad Poliwhirl. Father was a velociraptor. Exceptionally unamused. 12/10 would adopt https://t.co/VwdIk0OwVx,https://twitter.com/dog_rates/status/681981167097122816/photo/1,Jimothy,2015-12-29,23:32:35,,2903,1090,12.0,10.0,120.0
681654059175129088,iPhone Twitter,This is Toffee. He's a happy pupper. Appears dangerously fluffy. Extraordinarily spherical. 12/10 would pet firmly https://t.co/oEXEKt3MHu,https://twitter.com/dog_rates/status/681654059175129088/photo/1,Toffee,2015-12-29,01:52:46,pupper,2731,980,12.0,10.0,120.0
681610798867845120,iPhone Twitter,*collapses* 12/10 https://t.co/C7M8mnzHIK,https://twitter.com/dog_rates/status/681610798867845120/photo/1,,2015-12-28,23:00:52,,1985,503,12.0,10.0,120.0
681579835668455424,iPhone Twitter,This is Apollo. He thought you weren't coming back so he had a mental breakdown. 8/10 we've all been there https://t.co/ojUBrDCHLT,https://twitter.com/dog_rates/status/681579835668455424/photo/1,Apollo,2015-12-28,20:57:50,,3686,1375,8.0,10.0,80.0
681523177663676416,iPhone Twitter,This is Carly. She's actually 2 dogs fused together. Very innovative. Probably has superpowers. 12/10 for double dog https://t.co/GQn2IopLud,https://twitter.com/dog_rates/status/681523177663676416/photo/1,Carly,2015-12-28,17:12:42,,14860,6140,12.0,10.0,120.0
681339448655802368,iPhone Twitter,This is Asher. He's not wearing a seatbelt or keeping both paws on the wheel. Absolute menace on the roadways. 9/10 https://t.co/V3SWuHACkh,https://twitter.com/dog_rates/status/681339448655802368/photo/1,Asher,2015-12-28,05:02:37,,9646,4301,9.0,10.0,90.0
681297372102656000,iPhone Twitter,"This is actually a lion. We only rate dogs. For the last time please only send dogs. Thank u.
12/10 would still pet https://t.co/Pp26dMQxap",https://twitter.com/dog_rates/status/681297372102656000/photo/1,,2015-12-28,02:15:26,,3327,1017,12.0,10.0,120.0
681281657291280384,iPhone Twitter,Meet Sarge. His parents signed him up for dancing lessons but his true passion is roller coasters 11/10 very petable https://t.co/KvVoBIgkje,https://twitter.com/dog_rates/status/681281657291280384/photo/1,Sarge,2015-12-28,01:12:59,,3336,1167,11.0,10.0,110.00000000000001
681231109724700672,iPhone Twitter,I just love this pic. 11/10 this pupper is going places https://t.co/P16uhh1PbI,https://twitter.com/dog_rates/status/681231109724700672/photo/1,,2015-12-27,21:52:07,pupper,2490,513,11.0,10.0,110.00000000000001
680970795137544192,iPhone Twitter,I thought I made this very clear. We only rate dogs. Stop sending other things like this shark. Thank you... 9/10 https://t.co/CXSJZ4Stk3,https://twitter.com/dog_rates/status/680970795137544192/photo/1,,2015-12-27,04:37:44,,2518,707,9.0,10.0,90.0
680934982542561280,iPhone Twitter,Say hello to Sadie. She's a Tortellini Sidewinder. Very jubilant pup. Seems loyal. Leaves on point. 10/10 petable af https://t.co/g2bTu4ayPl,https://twitter.com/dog_rates/status/680934982542561280/photo/1,Sadie,2015-12-27,02:15:25,,2152,464,10.0,10.0,100.0
680913438424612864,iPhone Twitter,Meet Griswold. He's dapper as hell. Already pumped for next Christmas. 11/10 https://t.co/5NrpNDyFzN,https://twitter.com/dog_rates/status/680913438424612864/photo/1,Griswold,2015-12-27,00:49:49,,2486,654,11.0,10.0,110.00000000000001
680889648562991104,iPhone Twitter,This is Cheesy. It's her birthday. She's patiently waiting to eat her party muffin. 9/10 happy birthday pup https://t.co/cH2H7mch2H,https://twitter.com/dog_rates/status/680889648562991104/photo/1,Cheesy,2015-12-26,23:15:17,,1831,384,9.0,10.0,90.0
680836378243002368,iPhone Twitter,This is Ellie. She's secretly ferocious. 12/10 very deadly pupper https://t.co/BF4BW8LUgb,"https://twitter.com/dog_rates/status/680836378243002368/photo/1,https://twitter.com/dog_rates/status/680836378243002368/photo/1,https://twitter.com/dog_rates/status/680836378243002368/photo/1",Ellie,2015-12-26,19:43:36,pupper,3588,1406,12.0,10.0,120.0
680801747103793152,iPhone Twitter,Great picture here. Dog on the right panicked &amp; forgot about his tongue. Middle green dog must've fainted. All 10/10 https://t.co/31npKUAox0,https://twitter.com/dog_rates/status/680801747103793152/photo/1,,2015-12-26,17:25:59,,2456,872,10.0,10.0,100.0
680497766108381184,iPhone Twitter,Meet Percy. He's a Latvian Yuletide Heineken. Refuses to take off sweater. Kinda feisty. 12/10 would keep in pocket https://t.co/QGM5Fcuv7s,https://twitter.com/dog_rates/status/680497766108381184/photo/1,Percy,2015-12-25,21:18:05,,4394,2010,12.0,10.0,120.0
680440374763077632,iPhone Twitter,Merry Christmas. My gift to you is this tiny unicorn running into a wall in slow motion. 11/10 https://t.co/UKqIAnR3He,https://twitter.com/dog_rates/status/680440374763077632/video/1,,2015-12-25,17:30:01,,1511,535,11.0,10.0,110.00000000000001
680221482581123072,iPhone Twitter,This is CeCe. She's patiently waiting for Santa. 10/10 https://t.co/ZJUypFFwvg,https://twitter.com/dog_rates/status/680221482581123072/photo/1,CeCe,2015-12-25,03:00:14,,1515,306,10.0,10.0,100.0
680206703334408192,iPhone Twitter,I hope everyone enjoys this picture as much as I do. This is Toby. 12/10 https://t.co/vHnu1g9EJm,https://twitter.com/dog_rates/status/680206703334408192/photo/1,Toby,2015-12-25,02:01:30,,2941,1250,12.0,10.0,120.0
680176173301628928,iPhone Twitter,This pupper is patiently waiting to scare the shit out of Santa. 10/10 https://t.co/NhXo67K6yt,https://twitter.com/dog_rates/status/680176173301628928/photo/1,,2015-12-25,00:00:11,pupper,4042,1658,10.0,10.0,100.0
680145970311643136,iPhone Twitter,Say hello to Kawhi. He was doing fine until his hat fell off. He got it back though. 10/10 deep breaths pupper https://t.co/N5pM6WBx7e,"https://twitter.com/dog_rates/status/680145970311643136/photo/1,https://twitter.com/dog_rates/status/680145970311643136/photo/1,https://twitter.com/dog_rates/status/680145970311643136/photo/1",Kawhi,2015-12-24,22:00:10,pupper,3749,1848,10.0,10.0,100.0
680100725817409536,Vine,This pupper is not coming inside until she catches a snowflake on her tongue. 11/10 the determination is palpable https://t.co/lvMYbmKq8H,https://twitter.com/dog_rates/status/680100725817409536/photo/1,,2015-12-24,19:00:23,pupper,3698,1444,11.0,10.0,110.00000000000001
680085611152338944,Vine,This is by far the most coordinated series of pictures I was sent. Downright impressive in every way. 12/10 for all https://t.co/etzLo3sdZE,"https://twitter.com/dog_rates/status/680085611152338944/photo/1,https://twitter.com/dog_rates/status/680085611152338944/photo/1,https://twitter.com/dog_rates/status/680085611152338944/photo/1",,2015-12-24,18:00:19,,13240,9459,12.0,10.0,120.0
680070545539371008,Vine,Say hello to Emmie. She's trapped in an ornament. Tragic af. Looks pretty content tho. Maybe it's meant to be. 9/10 https://t.co/Fh7geodBCU,https://twitter.com/dog_rates/status/680070545539371008/photo/1,Emmie,2015-12-24,17:00:27,,2674,928,9.0,10.0,90.0
679877062409191424,iPhone Twitter,Meet Penelope. She's a bacon frise. Total babe (lol get it like the movie). Doesn't bark tho. 5/10 very average dog https://t.co/SDcQYg0HSZ,https://twitter.com/dog_rates/status/679877062409191424/photo/1,Penelope,2015-12-24,04:11:37,,2047,683,5.0,10.0,50.0
679872969355714560,TweetDeck,This is Rocco. He's in a very intense game of freeze tag. Currently waiting to be unfrozen 10/10 https://t.co/xZXUKVXJ7l,https://vine.co/v/iAAxTbj1UAM,Rocco,2015-12-24,03:55:21,,2261,699,10.0,10.0,100.0
679854723806179328,iPhone Twitter,This is Bruce. He's a rare pup. Covered in Frosted Flakes. Nifty gold teeth. Overall good dog. 7/10 would pet firmly https://t.co/RtxxACzZ8A,https://twitter.com/dog_rates/status/679854723806179328/photo/1,Bruce,2015-12-24,02:42:51,,2964,1304,7.0,10.0,70.0
679828447187857408,iPhone Twitter,Everybody look at this beautiful pupper 13/10 https://t.co/hyAC5Hq9GC,"https://twitter.com/dog_rates/status/679828447187857408/photo/1,https://twitter.com/dog_rates/status/679828447187857408/photo/1,https://twitter.com/dog_rates/status/679828447187857408/photo/1",,2015-12-24,00:58:27,pupper,37550,14844,13.0,10.0,130.0
679777920601223168,iPhone Twitter,This is Rinna. She's melting. 10/10 get inside pupper https://t.co/PA0czwucsb,https://twitter.com/dog_rates/status/679777920601223168/photo/1,Rinna,2015-12-23,21:37:40,pupper,3194,1176,10.0,10.0,100.0
679736210798047232,iPhone Twitter,This pup's name is Sabertooth (parents must be cool). Ears for days. Jumps unannounced. 9/10 would pet diligently https://t.co/iazoiNUviP,https://twitter.com/dog_rates/status/679736210798047232/photo/1,,2015-12-23,18:51:56,,2164,838,9.0,10.0,90.0
679729593985699840,iPhone Twitter,This is Hunter. He was playing with his ball minding his own business. Has no idea what happened to the carpet. 8/10 https://t.co/DbUTDI3u1R,https://twitter.com/dog_rates/status/679729593985699840/photo/1,Hunter,2015-12-23,18:25:38,,2243,868,8.0,10.0,80.0
679722016581222400,iPhone Twitter,This is Mike. He is a Jordanian Frito Pilates. Frowning because he can't see directly in front of him. 8/10 https://t.co/NL5QJwdEpF,https://twitter.com/dog_rates/status/679722016581222400/photo/1,Mike,2015-12-23,17:55:32,,1713,495,8.0,10.0,80.0
679527802031484928,iPhone Twitter,This little pupper just arrived. 11/10 would snug https://t.co/DA5aqnSGfB,https://twitter.com/dog_rates/status/679527802031484928/photo/1,,2015-12-23,05:03:47,pupper,2739,763,11.0,10.0,110.00000000000001
679511351870550016,iPhone Twitter,Say hello to William. He makes fun of others because he's terrified of his own deep-seated insecurities. 7/10 https://t.co/bwuV6FlRxr,https://twitter.com/dog_rates/status/679511351870550016/photo/1,William,2015-12-23,03:58:25,,3493,1341,7.0,10.0,70.0
679475951516934144,iPhone Twitter,This is Evy. She doesn't want to be a Koala. 9/10 https://t.co/VITeF0Kl9L,https://twitter.com/dog_rates/status/679475951516934144/photo/1,Evy,2015-12-23,01:37:45,,2163,672,9.0,10.0,90.0
679462823135686656,iPhone Twitter,Meet Hurley. He's the curly one. He hugs every other dog he sees during his walk. 11/10 for spreading the love https://t.co/M6vqkt2GKV,https://twitter.com/dog_rates/status/679462823135686656/photo/1,Hurley,2015-12-23,00:45:35,,32839,19879,11.0,10.0,110.00000000000001
679405845277462528,TweetDeck,Crazy unseen footage from Jurassic Park. 10/10 for both dinosaur puppers https://t.co/L8wt2IpwxO,https://vine.co/v/iKVFEigMLxP,,2015-12-22,20:59:10,,2455,1269,10.0,10.0,100.0
679158373988876288,iPhone Twitter,This is Rubio. He has too much skin. 11/10 https://t.co/NLOHmlENag,https://twitter.com/dog_rates/status/679158373988876288/photo/1,Rubio,2015-12-22,04:35:49,,22157,8548,11.0,10.0,110.00000000000001
679111216690831360,iPhone Twitter,This is officially the greatest yawn of all time. 12/10 https://t.co/4R0Cc0sLVE,https://twitter.com/dog_rates/status/679111216690831360/video/1,,2015-12-22,01:28:25,,6167,2698,12.0,10.0,120.0
679047485189439488,iPhone Twitter,This dog doesn't know how to stairs. Quite tragic really. 9/10 get it together pup https://t.co/kTpr9PTMg1,https://twitter.com/dog_rates/status/679047485189439488/photo/1,,2015-12-21,21:15:11,,2324,715,9.0,10.0,90.0
679001094530465792,TweetDeck,This is Rascal. He's paddling an imaginary canoe. 11/10 https://t.co/Ajquq6oGSg,https://vine.co/v/iKIwAzEatd6,Rascal,2015-12-21,18:10:50,,2918,1305,11.0,10.0,110.00000000000001
678969228704284672,iPhone Twitter,Meet Lola. She's a Metamorphic Chartreuse. Plays with her food. Insubordinate and churlish. Exquisite hardwood 11/10 https://t.co/etpBNXwN7f,https://twitter.com/dog_rates/status/678969228704284672/photo/1,Lola,2015-12-21,16:04:13,,1699,486,11.0,10.0,110.00000000000001
678800283649069056,iPhone Twitter,Here's a pupper with some mean tan lines. Snazzy sweater though 12/10 https://t.co/DpCSVsl6vu,https://twitter.com/dog_rates/status/678800283649069056/photo/1,,2015-12-21,04:52:53,pupper,2662,952,12.0,10.0,120.0
678798276842360832,iPhone Twitter,This is Linda. She fucking hates trees. 7/10 https://t.co/blaY85FIxR,https://twitter.com/dog_rates/status/678798276842360832/photo/1,Linda,2015-12-21,04:44:55,,3584,1252,7.0,10.0,70.0
678764513869611008,iPhone Twitter,"Meet Wilson. He got caught humping the futon. He's like ""dude, help me out here"" 10/10 I'd help Wilson out https://t.co/m6XoclB0qv",https://twitter.com/dog_rates/status/678764513869611008/photo/1,Wilson,2015-12-21,02:30:45,,1696,502,10.0,10.0,100.0
678755239630127104,iPhone Twitter,This is Dash. He didn't think the water would be that cold. Damn it Dash it's December. Think a little. 10/10 https://t.co/NqcOwG8pxW,https://twitter.com/dog_rates/status/678755239630127104/photo/1,Dash,2015-12-21,01:53:54,,7370,3484,10.0,10.0,100.0
678740035362037760,iPhone Twitter,Meet Tango. He's a large dog. Doesn't care much for personal space. Owner isn't very accepting. Tongue slip. 6/10 https://t.co/p2T5kGebxe,https://twitter.com/dog_rates/status/678740035362037760/photo/1,Tango,2015-12-21,00:53:29,,3875,1788,6.0,10.0,60.0
678708137298427904,TweetDeck,Here we are witnessing a wild field pupper. Lost his wallet in there. Rather unfortunate. 10/10 good luck pup https://t.co/sZy9Co74Bw,https://vine.co/v/eQjxxYaQ60K,,2015-12-20,22:46:44,pupper,5747,2547,10.0,10.0,100.0
678446151570427904,iPhone Twitter,Touching scene here. Really stirs up the emotions. The bond between father &amp; son. So beautiful. 10/10 for both pups https://t.co/AJWJHov5gx,https://twitter.com/dog_rates/status/678446151570427904/photo/1,,2015-12-20,05:25:42,,4125,1646,10.0,10.0,100.0
678424312106393600,iPhone Twitter,This is Crystal. She's a shitty fireman. No sense of urgency. People could be dying Crystal. 2/10 just irresponsible https://t.co/rtMtjSl9pz,https://twitter.com/dog_rates/status/678424312106393600/photo/1,Crystal,2015-12-20,03:58:55,,5584,2673,2.0,10.0,20.0
678410210315247616,iPhone Twitter,Say hello to Jerome. He can shoot french fries out of his mouth at insane speeds. Deadly af. 10/10 https://t.co/dIy88HwrX8,https://twitter.com/dog_rates/status/678410210315247616/photo/1,Jerome,2015-12-20,03:02:53,,4371,1920,10.0,10.0,100.0
678399652199309312,iPhone Twitter,This made my day. 12/10 please enjoy https://t.co/VRTbo3aAcm,https://twitter.com/dog_rates/status/678399652199309312/video/1,,2015-12-20,02:20:55,,81653,33417,12.0,10.0,120.0
678396796259975168,iPhone Twitter,These little fellas have opposite facial expressions. Both 12/10 https://t.co/LmThv0GWen,"https://twitter.com/dog_rates/status/678396796259975168/photo/1,https://twitter.com/dog_rates/status/678396796259975168/photo/1",,2015-12-20,02:09:34,,1639,443,12.0,10.0,120.0
678389028614488064,iPhone Twitter,"This is Bella. She just learned that her final grade in chem was a 92.49 
poor pupper 11/10 https://t.co/auOoKuoveM",https://twitter.com/dog_rates/status/678389028614488064/photo/1,Bella,2015-12-20,01:38:42,pupper,1929,441,11.0,10.0,110.00000000000001
678380236862578688,iPhone Twitter,This is Crumpet. He underestimated the snow. Quickly retreating. 10/10 https://t.co/a0Zx5LDFZa,https://twitter.com/dog_rates/status/678380236862578688/photo/1,Crumpet,2015-12-20,01:03:46,,2521,960,10.0,10.0,100.0
678341075375947776,iPhone Twitter,This pupper likes tape. 12/10 https://t.co/cSp6w5GWgm,https://twitter.com/dog_rates/status/678341075375947776/photo/1,,2015-12-19,22:28:09,pupper,1785,566,12.0,10.0,120.0
678334497360859136,iPhone Twitter,This is Rosie. She has a snazzy bow tie and a fin for a tail. Probably super fast underwater. Cool socks 10/10 https://t.co/GO76MdGBs0,https://twitter.com/dog_rates/status/678334497360859136/photo/1,Rosie,2015-12-19,22:02:01,,1344,271,10.0,10.0,100.0
678278586130948096,iPhone Twitter,Another spooky pupper here. Most definitely floating. No legs. Probably knows some dark magic. 10/10 very spooked https://t.co/JK8MByRzgj,https://twitter.com/dog_rates/status/678278586130948096/photo/1,,2015-12-19,18:19:51,pupper,11814,6389,10.0,10.0,100.0
678255464182861824,iPhone Twitter,This is Jessifer. She is a Bismoth Teriyaki. Flowers being attacked by hurricanes on bandana (rad). 9/10 stellar pup https://t.co/nZhmRwZzWv,https://twitter.com/dog_rates/status/678255464182861824/photo/1,Jessifer,2015-12-19,16:47:58,,1637,391,9.0,10.0,90.0
677918531514703872,iPhone Twitter,"""Everything looks pretty good in there. Make sure to brush your gums. Been flossing? How's school going?"" Both 10/10 https://t.co/lWL2IMJqLR",https://twitter.com/dog_rates/status/677918531514703872/photo/1,,2015-12-18,18:29:07,,1391,431,10.0,10.0,100.0
677895101218201600,iPhone Twitter,Guys this was terrifying. Really spooked me up. We don't rate ghosts. We rate dogs. Please only send dogs... 9/10 https://t.co/EJImi1udYb,https://twitter.com/dog_rates/status/677895101218201600/photo/1,,2015-12-18,16:56:01,,4979,2220,9.0,10.0,90.0
677716515794329600,iPhone Twitter,IT'S PUPPERGEDDON. Total of 144/120 ...I think https://t.co/ZanVtAtvIq,https://twitter.com/dog_rates/status/677716515794329600/photo/1,,2015-12-18,05:06:23,,3148,1013,144.0,120.0,120.0
677573743309385728,iPhone Twitter,This is Sandy. He's sexually confused. Thinks he's a pigeon. Also an All-American cheese catcher. 10/10 so petable https://t.co/Htu8plSqEu,"https://twitter.com/dog_rates/status/677573743309385728/photo/1,https://twitter.com/dog_rates/status/677573743309385728/photo/1",Sandy,2015-12-17,19:39:03,,2204,760,10.0,10.0,100.0
677557565589463040,iPhone Twitter,Reckless pupper here. Not even looking at road. Absolute menace. No regard for fellow pupper lives. 10/10 still cute https://t.co/96IBkOYB7j,https://twitter.com/dog_rates/status/677557565589463040/photo/1,,2015-12-17,18:34:46,pupper,2505,1218,10.0,10.0,100.0
677547928504967168,iPhone Twitter,Not much to say here. I just think everyone needs to see this. 12/10 https://t.co/AGag0hFHpe,https://twitter.com/dog_rates/status/677547928504967168/photo/1,,2015-12-17,17:56:29,,7130,3820,12.0,10.0,120.0
677530072887205888,iPhone Twitter,Say hello to Axel. He's a Black Chevy Pinot on wheels. 0 to 60 in 5.7 seconds (if downhill). 9/10 I call shotgun https://t.co/DKe9DBnnHE,https://twitter.com/dog_rates/status/677530072887205888/photo/1,Axel,2015-12-17,16:45:31,,1105,237,9.0,10.0,90.0
677335745548390400,TweetDeck,Downright inspiring 12/10 https://t.co/vSLtYBWHcQ,https://vine.co/v/hbLbH77Ar67,,2015-12-17,03:53:20,,3126,1873,12.0,10.0,120.0
677334615166730240,iPhone Twitter,This dog gave up mid jump. 9/10 https://t.co/KmMv3Y2zI8,"https://twitter.com/dog_rates/status/677334615166730240/photo/1,https://twitter.com/dog_rates/status/677334615166730240/photo/1",,2015-12-17,03:48:51,,1391,307,9.0,10.0,90.0
677331501395156992,iPhone Twitter,Meet Humphrey. He's a Northern Polyp Viagra. One ear works. Face stuck like that. Always surprised. 9/10 petable af https://t.co/FS7eJQM2F4,https://twitter.com/dog_rates/status/677331501395156992/photo/1,Humphrey,2015-12-17,03:36:28,,1125,245,9.0,10.0,90.0
677328882937298944,iPhone Twitter,This is Derek. All the dogs adore Derek. He's a great guy. 10/10 really solid pup https://t.co/KgcsGNb61s,https://twitter.com/dog_rates/status/677328882937298944/photo/1,Derek,2015-12-17,03:26:04,,3731,1572,10.0,10.0,100.0
677301033169788928,iPhone Twitter,This is Juckson. He's totally on his way to a nascar race. 5/10 for Juckson https://t.co/IoLRvF0Kak,https://twitter.com/dog_rates/status/677301033169788928/photo/1,Juckson,2015-12-17,01:35:24,,1277,430,5.0,10.0,50.0
677269281705472000,iPhone Twitter,This is the happiest pupper I've ever seen. 10/10 would trade lives with https://t.co/ep8ATEJwRb,https://twitter.com/dog_rates/status/677269281705472000/photo/1,,2015-12-16,23:29:14,pupper,2051,740,10.0,10.0,100.0
677228873407442944,iPhone Twitter,Say hello to Chuq. He just wants to fit in. 11/10 https://t.co/hGkMCjZzn4,https://twitter.com/dog_rates/status/677228873407442944/photo/1,Chuq,2015-12-16,20:48:40,,3644,1718,11.0,10.0,110.00000000000001
677187300187611136,iPhone Twitter,Here we see a Byzantine Rigatoni. Very aerodynamic. No eyes. Actually not windy here they just look like that. 9/10 https://t.co/gzI0m6wXRo,https://twitter.com/dog_rates/status/677187300187611136/photo/1,,2015-12-16,18:03:28,,2802,967,9.0,10.0,90.0
676957860086095872,iPhone Twitter,10/10 I'd follow this dog into battle no questions asked https://t.co/ngTNXYQF0L,https://twitter.com/dog_rates/status/676957860086095872/video/1,,2015-12-16,02:51:45,,2274,844,10.0,10.0,100.0
676948236477857792,iPhone Twitter,This is Karl. Karl thinks he's slick. 6/10 sneaky pup https://t.co/Lo4ALwjVh4,https://twitter.com/dog_rates/status/676948236477857792/photo/1,Karl,2015-12-16,02:13:31,,2230,911,6.0,10.0,60.0
676936541936185344,iPhone Twitter,Here we see a rare pouched pupper. Ample storage space. Looks alert. Jumps at random. Kicked open that door. 8/10 https://t.co/mqvaxleHRz,https://twitter.com/dog_rates/status/676936541936185344/photo/1,,2015-12-16,01:27:03,pupper,13050,5123,8.0,10.0,80.0
676916996760600576,TweetDeck,Super speedy pupper. Does not go gentle into that goodnight. 10/10 https://t.co/uPXBXS1XNb,https://vine.co/v/imJ0BdZOJTw,,2015-12-16,00:09:23,pupper,3048,1879,10.0,10.0,100.0
676864501615042560,iPhone Twitter,Meet Ash. He's just a head now. Lost his body during the Third Crusade. Still in good spirits. 10/10 would pet well https://t.co/NJj2uP0atK,https://twitter.com/dog_rates/status/676864501615042560/photo/1,Ash,2015-12-15,20:40:47,,2155,741,10.0,10.0,100.0
676811746707918848,iPhone Twitter,Say hello to Penny &amp; Gizmo. They are practicing their caroling. The ambition in the room is tangible. 9/10 for both https://t.co/aqBHjjh5VD,https://twitter.com/dog_rates/status/676811746707918848/photo/1,Penny,2015-12-15,17:11:09,,1451,443,9.0,10.0,90.0
676776431406465024,iPhone Twitter,"When someone yells ""cops!"" at a party and you gotta get your drunk friend out of there. 10/10 https://t.co/4rMZi5Ca1k",https://twitter.com/dog_rates/status/676776431406465024/video/1,,2015-12-15,14:50:49,,5135,2096,10.0,10.0,100.0
676617503762681856,iPhone Twitter,I promise this wasn't meant to be a cuteness overload account but ermergerd look at this cozy pupper. 13/10 https://t.co/mpQl2rJjDh,https://twitter.com/dog_rates/status/676617503762681856/photo/1,,2015-12-15,04:19:18,pupper,2971,1027,13.0,10.0,130.0
676606785097199616,iPhone Twitter,*screeches for a sec and then faints* 12/10 https://t.co/N5QL4ySBEx,https://twitter.com/dog_rates/status/676606785097199616/photo/1,,2015-12-15,03:36:42,,1926,458,12.0,10.0,120.0
676603393314578432,iPhone Twitter,This is Godzilla pupper. He had a ruff childhood &amp; now deflects that pain outward by terrorizing cities. Tragic 9/10 https://t.co/g1tLGkyaxr,https://twitter.com/dog_rates/status/676603393314578432/photo/1,Godzilla,2015-12-15,03:23:14,pupper,1192,400,9.0,10.0,90.0
676593408224403456,TweetDeck,This pupper loves leaves. 11/10 for committed leaf lover https://t.co/APvLqbEhkF,https://vine.co/v/eEQQaPFbgOY,,2015-12-15,02:43:33,pupper,4687,2253,11.0,10.0,110.00000000000001
676582956622721024,iPhone Twitter,"Meet Vinnie. He's having fun while being safe. Well not a lot of fun, but definitely safe, and that's important 8/10 https://t.co/vZYtynZZlH",https://twitter.com/dog_rates/status/676582956622721024/photo/1,Vinnie,2015-12-15,02:02:01,,1232,290,8.0,10.0,80.0
676533798876651520,iPhone Twitter,ITSOFLUFFAYYYYY 12/10 https://t.co/bfw13CnuuZ,https://twitter.com/dog_rates/status/676533798876651520/photo/1,,2015-12-14,22:46:41,,1920,582,12.0,10.0,120.0
676430933382295552,iPhone Twitter,"Meet Duke. He's an Urban Parmesan. They know he's scared of the green rubber dog. ""Why u do dis?"" thinks Duke. 10/10 https://t.co/3bim9U5Idr",https://twitter.com/dog_rates/status/676430933382295552/photo/1,Duke,2015-12-14,15:57:56,,1428,360,10.0,10.0,100.0
676263575653122048,iPhone Twitter,All this pupper wanted to do was go skiing. No one told him about the El NiÃ±o. Poor pupper. 10/10 maybe next year https://t.co/fTgbq1UBR9,https://twitter.com/dog_rates/status/676263575653122048/photo/1,,2015-12-14,04:52:55,pupper,2128,575,10.0,10.0,100.0
676219687039057920,iPhone Twitter,This is Kenneth. He's stuck in a bubble. 10/10 hang in there Kenneth https://t.co/uQt37xlYMJ,https://twitter.com/dog_rates/status/676219687039057920/photo/1,Kenneth,2015-12-14,01:58:31,,77275,32360,10.0,10.0,100.0
676215927814406144,iPhone Twitter,This is Herm. He just wants to be like the other dogs. Sneaky tongue slip. Super fuzzy. 9/10 would cuddle firmly https://t.co/tg8h9lzCHv,https://twitter.com/dog_rates/status/676215927814406144/photo/1,Herm,2015-12-14,01:43:35,,1785,607,9.0,10.0,90.0
676121918416756736,TweetDeck,Here we are witnessing a very excited dog. Clearly has no control over neck movements. 8/10 would still pet https://t.co/ICNIjSkrXs,https://vine.co/v/iZXg7VpeDAv,,2015-12-13,19:30:01,,2205,1205,8.0,10.0,80.0
676101918813499392,iPhone Twitter,Meet Striker. He's ready for Christmas. 11/10 https://t.co/B3xxSLjQSH,https://twitter.com/dog_rates/status/676101918813499392/photo/1,Striker,2015-12-13,18:10:33,,2881,1210,11.0,10.0,110.00000000000001
676089483918516224,iPhone Twitter,"""Yes hello I'ma just snag this here toasted bagel real quick. carry on."" 9/10 https://t.co/Cuz0Osnekp",https://twitter.com/dog_rates/status/676089483918516224/photo/1,,2015-12-13,17:21:08,,1346,449,9.0,10.0,90.0
