tweet_id,source,text,image_urls,name,date,time,dog_stage,favorite_count,retweet_count,rating_numerator,rating_denominator,rating_percentage
711363825979756544,iPhone Twitter,"""Please, no puparazzi"" 11/10 https://t.co/nJIXSPfedK","https://twitter.com/dog_rates/status/711363825979756544/photo/1,https://twitter.com/dog_rates/status/711363825979756544/photo/1",,2016-03-20,01:28:47,,3793,1189,11.0,10.0,110.00000000000001
711306686208872448,iPhone Twitter,What hooligan sent in pictures w/out a dog in them? Churlish af. 3/10 just bc that's a neat fluffy bean bag chair https://t.co/wcwoGOkZvz,"https://twitter.com/dog_rates/status/711306686208872448/photo/1,https://twitter.com/dog_rates/status/711306686208872448/photo/1",,2016-03-19,21:41:44,,3429,769,3.0,10.0,30.0
711008018775851008,iPhone Twitter,This is Chuckles. He had a balloon but he accidentally let go of it and it floated away. 11/10 hang in there pupper https://t.co/68iNM7B5gW,https://twitter.com/dog_rates/status/711008018775851008/photo/1,Chuckles,2016-03-19,01:54:56,pupper,3099,646,11.0,10.0,110.00000000000001
710833117892898816,iPhone Twitter,Say hello to Sora. She's an Egyptian Pumpernickel. Mesmerizing af. 12/10 would bring home to mom https://t.co/PmTR4kxZkq,https://twitter.com/dog_rates/status/710833117892898816/photo/1,Sora,2016-03-18,14:19:56,,2786,559,12.0,10.0,120.0
710609963652087808,TweetDeck,I've watched this a million times and you probably will too. 12/10 (vid by @emily_galasso) https://t.co/DU7Rb3NDiy,https://vine.co/v/idaTpwH5TgU,,2016-03-17,23:33:12,,4964,2481,12.0,10.0,120.0
710283270106132480,iPhone Twitter,This is Gunner. He's a Figamus Newton. King of the peek-a-boo. Cool jeans. 11/10 https://t.co/ONuBILIYXZ,"https://twitter.com/dog_rates/status/710283270106132480/photo/1,https://twitter.com/dog_rates/status/710283270106132480/photo/1",Gunner,2016-03-17,01:55:02,,2218,541,11.0,10.0,110.00000000000001
710272297844797440,iPhone Twitter,We ðŸ‘ðŸ» only ðŸ‘ðŸ» rate ðŸ‘ðŸ» dogs. Pls stop sending in non-canines like this Dutch Panda Worm. This is infuriating. 11/10 https://t.co/odfLzBonG2,https://twitter.com/dog_rates/status/710272297844797440/photo/1,,2016-03-17,01:11:26,,4705,1316,11.0,10.0,110.00000000000001
710269109699739648,iPhone Twitter,"The squad is back for St. Patrick's Day! â˜˜ ðŸ’š
13/10 for all https://t.co/OcCDb2bng5",https://twitter.com/dog_rates/status/710269109699739648/photo/1,,2016-03-17,00:58:46,,2487,1182,13.0,10.0,130.0
710153181850935296,iPhone Twitter,This is Lacy. She's tipping her hat to you. Daydreams of her life back on the frontier. 11/10 would pet so well https://t.co/fG5Pk3Et1I,"https://twitter.com/dog_rates/status/710153181850935296/photo/1,https://twitter.com/dog_rates/status/710153181850935296/photo/1",Lacy,2016-03-16,17:18:07,,3005,936,11.0,10.0,110.00000000000001
710140971284037632,iPhone Twitter,This is Tater. His underbite is fierce af. Doesn't give a damn about your engagement photo. 8/10 https://t.co/nLuPY3pY12,https://twitter.com/dog_rates/status/710140971284037632/photo/1,Tater,2016-03-16,16:29:35,,2862,933,8.0,10.0,80.0
710117014656950272,iPhone Twitter,This pupper got her hair chalked for her birthday. Hasn't told her parents yet. Rebellious af. 11/10 very nifty https://t.co/h1OX2mLtxV,"https://twitter.com/dog_rates/status/710117014656950272/photo/1,https://twitter.com/dog_rates/status/710117014656950272/photo/1",,2016-03-16,14:54:24,pupper,5693,2096,11.0,10.0,110.00000000000001
709901256215666688,iPhone Twitter,"WeRateDogs stickers are here and they're 12/10! Use code ""puppers"" at checkout ðŸ¶ðŸ¾

Shop now: https://t.co/k5xsufRKYm https://t.co/ShXk46V13r","http://goo.gl/ArWZfi,https://twitter.com/dog_rates/status/709901256215666688/photo/1,https://twitter.com/dog_rates/status/709901256215666688/photo/1,https://twitter.com/dog_rates/status/709901256215666688/photo/1,https://twitter.com/dog_rates/status/709901256215666688/photo/1",,2016-03-16,00:37:03,,697,105,12.0,10.0,120.0
709566166965075968,iPhone Twitter,This is Olaf. He's gotta be rare. Seems sturdy. Tail is floofy af. 12/10 would do whatever it takes to pet https://t.co/E9jaU59bh9,https://twitter.com/dog_rates/status/709566166965075968/photo/1,Olaf,2016-03-15,02:25:31,,3667,1264,12.0,10.0,120.0
709519240576036864,iPhone Twitter,This is Vince. He's a Gregorian Flapjeck. White spot on legs almost looks like another dog (whoa). 9/10 rad as hell https://t.co/aczGAV2dK4,https://twitter.com/dog_rates/status/709519240576036864/photo/1,Vince,2016-03-14,23:19:03,,1543,246,9.0,10.0,90.0
709449600415961088,iPhone Twitter,Meet Karma. She's just a head. Lost body during the Second Punic War (unfortunate). Loves to travel 10/10 petable af https://t.co/c6af6nYEPo,"https://twitter.com/dog_rates/status/709449600415961088/photo/1,https://twitter.com/dog_rates/status/709449600415961088/photo/1",Karma,2016-03-14,18:42:20,,2316,606,10.0,10.0,100.0
709409458133323776,iPhone Twitter,This is Billy. He sensed a squirrel. 8/10 damn it Billy https://t.co/Yu0K98VZ9A,https://twitter.com/dog_rates/status/709409458133323776/photo/1,Billy,2016-03-14,16:02:49,,2709,723,8.0,10.0,80.0
709225125749587968,iPhone Twitter,This is Walker. He's a Butternut Khalifa. Appears fuzzy af. 11/10 would hug for a ridiculous amount of time https://t.co/k6fEWHSALn,https://twitter.com/dog_rates/status/709225125749587968/photo/1,Walker,2016-03-14,03:50:21,,2497,599,11.0,10.0,110.00000000000001
709198395643068416,iPhone Twitter,"From left to right:
Cletus, Jerome, Alejandro, Burp, &amp; Titson
None know where camera is. 45/50 would hug all at once https://t.co/sedre1ivTK",https://twitter.com/dog_rates/status/709198395643068416/photo/1,,2016-03-14,02:04:08,,2511,672,45.0,50.0,90.0
709179584944730112,TweetDeck,This is Sammy. He's in a tree. Very excited about it. 13/10 https://t.co/CLe9ETEjeF,https://vine.co/v/iwAjdlEjwMl,Sammy,2016-03-14,00:49:23,,2076,701,13.0,10.0,130.0
709042156699303936,iPhone Twitter,This is Klevin. He's addicted to sandwiches (yes a hotdog is a sandwich fight me) It's tearing his family apart 9/10 https://t.co/7BkkVNu5pd,https://twitter.com/dog_rates/status/709042156699303936/photo/1,Klevin,2016-03-13,15:43:18,,4925,1722,9.0,10.0,90.0
708853462201716736,TweetDeck,This is Lucy. She doesn't understand fetch. 8/10 try turning off and back on (vid by @rileyyoungblood) https://t.co/RXjEwpVJf0,https://vine.co/v/iHl2UDEBZ95,Lucy,2016-03-13,03:13:29,,1855,691,8.0,10.0,80.0
708834316713893888,iPhone Twitter,Meet Malikai. He was rolling around having fun when he remembered the inevitable heat death of the universe. 10/10 https://t.co/Vd2FqHIIGn,https://twitter.com/dog_rates/status/708834316713893888/photo/1,Malikai,2016-03-13,01:57:25,,1754,531,10.0,10.0,100.0
708738143638450176,iPhone Twitter,This is Coco. She gets to stay on the Bachelor for another week. Super pumped 11/10 https://t.co/wsCB6LFNxD,https://twitter.com/dog_rates/status/708738143638450176/photo/1,Coco,2016-03-12,19:35:15,,2843,860,11.0,10.0,110.00000000000001
708469915515297792,iPhone Twitter,This is Bobble. He's a Croatian Galifianakis. Hears everything within 400 miles. 11/10 would snug diligently https://t.co/VwDc6PTDzk,https://twitter.com/dog_rates/status/708469915515297792/photo/1,Bobble,2016-03-12,01:49:25,,3203,861,11.0,10.0,110.00000000000001
708356463048204288,iPhone Twitter,This is Oliver. That is his castle. He protects it with his life. He's also squishy af. 10/10 would squish softly https://t.co/oSuEGw0BhX,"https://twitter.com/dog_rates/status/708356463048204288/photo/1,https://twitter.com/dog_rates/status/708356463048204288/photo/1",Oliver,2016-03-11,18:18:36,,3733,1395,10.0,10.0,100.0
708130923141795840,iPhone Twitter,Please stop sending in non canines like this Guatemalan Twiggle Bunny. We only rate dogs. Only send in dogs... 11/10 https://t.co/XKhobeGuvT,https://twitter.com/dog_rates/status/708130923141795840/photo/1,,2016-03-11,03:22:23,,3516,880,11.0,10.0,110.00000000000001
708119489313951744,iPhone Twitter,This is Cooper. He basks in the glory of rebellion. 9/10 probably a preteen https://t.co/kDamUfeIpm,https://twitter.com/dog_rates/status/708119489313951744/photo/1,Cooper,2016-03-11,02:36:57,,2775,1028,9.0,10.0,90.0
708109389455101952,iPhone Twitter,This is Remington. He was caught off guard by the magical floating cheese. Spooked af. 10/10 deep breaths pup https://t.co/mhPSADiJmZ,https://twitter.com/dog_rates/status/708109389455101952/photo/1,Remington,2016-03-11,01:56:49,,1999,568,10.0,10.0,100.0
707995814724026368,iPhone Twitter,This is Farfle. He lost his back legs during the Battle of Gettysburg. Goes 0-60 in 4.3 seconds (damn) 12/10 hero af https://t.co/NiQQWzIzzq,https://twitter.com/dog_rates/status/707995814724026368/photo/1,Farfle,2016-03-10,18:25:30,,3247,1179,12.0,10.0,120.0
707969809498152960,iPhone Twitter,Meet Rufus. He's a Honeysuckle Firefox. Curly af. Badass tie. About to go on his first date ever 11/10 good luck pup https://t.co/dGoTWNfIsm,https://twitter.com/dog_rates/status/707969809498152960/photo/1,Rufus,2016-03-10,16:42:10,,2801,1019,11.0,10.0,110.00000000000001
707776935007539200,iPhone Twitter,This is Sadie. She's a Bohemian Rhapsody. Remarkably portable. Could sneak on roller coasters with (probably). 11/10 https://t.co/DB8fyeDs8B,https://twitter.com/dog_rates/status/707776935007539200/photo/1,Sadie,2016-03-10,03:55:45,,3405,995,11.0,10.0,110.00000000000001
707420581654872064,iPhone Twitter,This is Keurig. He's a rare dog. Laughs like an idiot tho. Head is basically a weapon. Poorly maintained goatee 4/10 https://t.co/xOrUyj7K30,https://twitter.com/dog_rates/status/707420581654872064/photo/1,Keurig,2016-03-09,04:19:44,,2360,725,4.0,10.0,40.0
707411934438625280,iPhone Twitter,"""I shall trip the big pupper with leash. Big pupper will never see it coming. I am a genius."" Both 11/10 https://t.co/uQsCJ8pf51",https://twitter.com/dog_rates/status/707411934438625280/photo/1,,2016-03-09,03:45:22,pupper,2371,622,11.0,10.0,110.00000000000001
707387676719185920,iPhone Twitter,Meet Clarkus. He's a Skinny Eastern Worcestershire. Can tie own shoes (impressive af) 10/10 would put on track team https://t.co/XP5o7zGn0E,https://twitter.com/dog_rates/status/707387676719185920/photo/1,Clarkus,2016-03-09,02:08:59,,3631,1363,10.0,10.0,100.0
707377100785885184,iPhone Twitter,This dog just brutally murdered a snowman. Currently toying with its nutritious remains 9/10 would totally still pet https://t.co/iKThgKnW1j,"https://twitter.com/dog_rates/status/707377100785885184/photo/1,https://twitter.com/dog_rates/status/707377100785885184/photo/1",,2016-03-09,01:26:57,,3404,1136,9.0,10.0,90.0
707297311098011648,iPhone Twitter,This is Cassie. She can go from sweet to scary af in a matter of seconds. 10/10 points deducted for cats on pajamas https://t.co/B6dmZmJBdK,"https://twitter.com/dog_rates/status/707297311098011648/photo/1,https://twitter.com/dog_rates/status/707297311098011648/photo/1",Cassie,2016-03-08,20:09:54,,2876,831,10.0,10.0,100.0
707059547140169728,iPhone Twitter,Say hello to Cupcake. She's an Icelandic Dippen Dot. Confused by the oddly geometric lawn pattern. 11/10 https://t.co/D7rorf4YKL,"https://twitter.com/dog_rates/status/707059547140169728/photo/1,https://twitter.com/dog_rates/status/707059547140169728/photo/1",Cupcake,2016-03-08,04:25:07,,2677,710,11.0,10.0,110.00000000000001
707038192327901184,iPhone Twitter,This is Kathmandu. He sees every move you make. Probably knows Jiu-Jitsu. 10/10 mysterious af https://t.co/z0cs7E4Xjj,"https://twitter.com/dog_rates/status/707038192327901184/photo/1,https://twitter.com/dog_rates/status/707038192327901184/photo/1",Kathmandu,2016-03-08,03:00:15,,2270,833,10.0,10.0,100.0
707021089608753152,iPhone Twitter,This is Tucker. He's a Dasani Episcopalian. Good lord what a tongue. 12/10 would never let go of https://t.co/gHtW5cgyy7,"https://twitter.com/dog_rates/status/707021089608753152/photo/1,https://twitter.com/dog_rates/status/707021089608753152/photo/1",Tucker,2016-03-08,01:52:18,,4221,1437,12.0,10.0,120.0
707014260413456384,iPhone Twitter,This is Ellie. She requests to be carried around in a lacrosse stick at all times. 11/10 impossible to say no https://t.co/15yCmd43zU,https://twitter.com/dog_rates/status/707014260413456384/photo/1,Ellie,2016-03-08,01:25:10,,2386,624,11.0,10.0,110.00000000000001
706904523814649856,TweetDeck,Ever seen a dog pet another dog? Both 13/10 truly an awe-inspiring scene. (Vid by @mdougherty20) https://t.co/3PoKf6cw7f,https://vine.co/v/iXQAm5Lrgrh,,2016-03-07,18:09:06,,15120,8245,13.0,10.0,130.0
706901761596989440,iPhone Twitter,This is Elliot. He's blocking the roadway. Downright rude as hell. Doesn't care that you're already late. 3/10 https://t.co/FMUxir5pYu,https://twitter.com/dog_rates/status/706901761596989440/photo/1,Elliot,2016-03-07,17:58:08,,2141,627,3.0,10.0,30.0
706681918348251136,iPhone Twitter,Say hello to Katie. She's a Mitsubishi Hufflepuff. Curly af. 12/10 I'd do terrible things to acquire such a pup https://t.co/CFPIcGcwJv,"https://twitter.com/dog_rates/status/706681918348251136/photo/1,https://twitter.com/dog_rates/status/706681918348251136/photo/1,https://twitter.com/dog_rates/status/706681918348251136/photo/1",Katie,2016-03-07,03:24:33,,3451,1019,12.0,10.0,120.0
706644897839910912,iPhone Twitter,Meet Shadow. She's tired of the responsibilities associated with being a dog. No longer strives to attain ball. 9/10 https://t.co/cdOkfEpjFw,https://twitter.com/dog_rates/status/706644897839910912/video/1,Shadow,2016-03-07,00:57:27,,2675,1154,9.0,10.0,90.0
706516534877929472,iPhone Twitter,Please enjoy this pup in a cooler. Permanently ready for someone to throw a tennis ball his way. 12/10 https://t.co/KUS0xl7XIp,https://twitter.com/dog_rates/status/706516534877929472/photo/1,,2016-03-06,16:27:23,,3212,1088,12.0,10.0,120.0
706346369204748288,iPhone Twitter,This is Koda. She's a Beneboom Cumberwiggle. 12/10 petable as hell https://t.co/VZV6oMJmU6,"https://twitter.com/dog_rates/status/706346369204748288/photo/1,https://twitter.com/dog_rates/status/706346369204748288/photo/1",Koda,2016-03-06,05:11:12,,3575,968,12.0,10.0,120.0
706310011488698368,iPhone Twitter,Here's a very sleepy pupper. Thinks it's an airplane. 12/10 would snug for eternity https://t.co/GGmcTIkBbf,"https://twitter.com/dog_rates/status/706310011488698368/photo/1,https://twitter.com/dog_rates/status/706310011488698368/photo/1",,2016-03-06,02:46:44,pupper,22138,8404,12.0,10.0,120.0
706291001778950144,iPhone Twitter,When you're just relaxin and having a swell time but then remember you have to fill out the FAFSA ...11/10 https://t.co/qy33OBcexg,"https://twitter.com/dog_rates/status/706291001778950144/photo/1,https://twitter.com/dog_rates/status/706291001778950144/photo/1",,2016-03-06,01:31:11,,1765,491,11.0,10.0,110.00000000000001
706265994973601792,iPhone Twitter,"This is Kara. She's been trying to solve that thing for 3 days. ""I don't have thumbs,"" she said. 11/10 solid effort https://t.co/lA6a8GefrV",https://twitter.com/dog_rates/status/706265994973601792/photo/1,Kara,2016-03-05,23:51:49,,2835,969,11.0,10.0,110.00000000000001
706166467411222528,iPhone Twitter,This is Dexter. He's a shy pup. Doesn't bark much. Dreadful fetcher. Has rare sun allergy. 7/10 still petable https://t.co/sA7P3JSqiv,https://twitter.com/dog_rates/status/706166467411222528/photo/1,Dexter,2016-03-05,17:16:20,,5332,1687,7.0,10.0,70.0
706153300320784384,TweetDeck,This is Layla. She's giving you a standing ovation.13/10 just magnificent (vid by @CSBrzezinski) https://t.co/KxYXHUHUi2,https://vine.co/v/iXidJXBJ3P9,Layla,2016-03-05,16:24:01,,1539,401,13.0,10.0,130.0
705975130514706432,iPhone Twitter,This is Adele. Her tongue flies out of her mouth at random. It's a debilitating illness. 10/10 stay strong pupper https://t.co/cfn81n3FLO,"https://twitter.com/dog_rates/status/705975130514706432/photo/1,https://twitter.com/dog_rates/status/705975130514706432/photo/1",Adele,2016-03-05,04:36:02,pupper,3219,770,10.0,10.0,100.0
705970349788291072,iPhone Twitter,This is Lucy. She's a Venetian Kerploof. Supposed to be navigating. Quite irresponsible. Fancy ass collar tho 12/10 https://t.co/8tjnz1L8DI,https://twitter.com/dog_rates/status/705970349788291072/photo/1,Lucy,2016-03-05,04:17:02,,3251,932,12.0,10.0,120.0
705428427625635840,iPhone Twitter,This is Ambrose. He's an Alfalfa Ballyhoo. Draws pistol fast af. Pretty much runs the frontier. 11/10 lethal pupper https://t.co/ih6epBOxIA,https://twitter.com/dog_rates/status/705428427625635840/photo/1,Ambrose,2016-03-03,16:23:38,pupper,3956,1772,11.0,10.0,110.00000000000001
705239209544720384,iPhone Twitter,This is Jimothy. He lost his body during the the Third Crusade (tragic). 11/10 heroic af tho https://t.co/wnsblfu7XE,https://twitter.com/dog_rates/status/705239209544720384/photo/1,Jimothy,2016-03-03,03:51:44,,3109,782,11.0,10.0,110.00000000000001
705223444686888960,iPhone Twitter,This is Bode. He's a heavy sleeper. 9/10 https://t.co/YMkxhGWUqv,https://twitter.com/dog_rates/status/705223444686888960/photo/1,Bode,2016-03-03,02:49:06,,2669,846,9.0,10.0,90.0
705102439679201280,iPhone Twitter,This is Terrenth. He just stubbed his toe. 10/10 deep breaths Terrenth https://t.co/Pg18CDFC7Z,https://twitter.com/dog_rates/status/705102439679201280/photo/1,Terrenth,2016-03-02,18:48:16,,2233,536,10.0,10.0,100.0
704859558691414016,iPhone Twitter,Here is a heartbreaking scene of an incredible pupper being laid to rest. 10/10 RIP pupper https://t.co/81mvJ0rGRu,https://twitter.com/dog_rates/status/704859558691414016/photo/1,,2016-03-02,02:43:09,pupper,2336,573,10.0,10.0,100.0
704819833553219584,iPhone Twitter,This is Chesterson. He's a Bolivian Scoop Dog. Incredibly portable. Can't bark for shit tho. 7/10 would still pet https://t.co/EatAd8JhyW,https://twitter.com/dog_rates/status/704819833553219584/photo/1,Chesterson,2016-03-02,00:05:17,,2738,1043,7.0,10.0,70.0
704761120771465216,iPhone Twitter,This pupper killed this great white in an epic sea battle. Now wears it as a trophy. Such brave. Much fierce. 13/10 https://t.co/Lu0ECu5tO5,"https://twitter.com/dog_rates/status/704761120771465216/photo/1,https://twitter.com/dog_rates/status/704761120771465216/photo/1",,2016-03-01,20:11:59,pupper,6872,3049,13.0,10.0,130.0
704499785726889984,iPhone Twitter,When you wake up from a long nap and have no idea who you are. 12/10 https://t.co/dlF93GLnDc,https://twitter.com/dog_rates/status/704499785726889984/photo/1,,2016-03-01,02:53:32,,3038,1052,12.0,10.0,120.0
704364645503647744,iPhone Twitter,Say hello to Bisquick. He's a Beneplop Cumbersnug. Even smiles when wet. 12/10 I'd steal Bisquick https://t.co/5zX5XD3i6K,"https://twitter.com/dog_rates/status/704364645503647744/photo/1,https://twitter.com/dog_rates/status/704364645503647744/photo/1",Bisquick,2016-02-29,17:56:32,,8312,3736,12.0,10.0,120.0
704347321748819968,iPhone Twitter,This is Ralphson. He's very confused. Wondering why he's sitting on Santa's lap in February. 10/10 stay woke pupper https://t.co/INphk4ltkZ,https://twitter.com/dog_rates/status/704347321748819968/photo/1,Ralphson,2016-02-29,16:47:42,pupper,1651,364,10.0,10.0,100.0
704134088924532736,TweetDeck,This sneezy pupper is just adorable af. 12/10 (vid by @gwilks1) https://t.co/h5aI0Tim4j,https://vine.co/v/igW2OEwu9vg,,2016-02-29,02:40:23,pupper,1563,493,12.0,10.0,120.0
704054845121142784,iPhone Twitter,Here is a whole flock of puppers.  60/50 I'll take the lot https://t.co/9dpcw6MdWa,https://twitter.com/dog_rates/status/704054845121142784/photo/1,,2016-02-28,21:25:30,,3032,953,60.0,50.0,120.0
703774238772166656,iPhone Twitter,"""YOU CAN'T HANDLE THE TRUTH"" both 10/10 https://t.co/ZvxdB4i9AG",https://twitter.com/dog_rates/status/703774238772166656/photo/1,,2016-02-28,02:50:28,,1907,488,10.0,10.0,100.0
703769065844768768,iPhone Twitter,When you're trying to watch your favorite tv show but your friends keep interrupting. 10/10 relatable af https://t.co/QQZDCYl6zT,"https://twitter.com/dog_rates/status/703769065844768768/photo/1,https://twitter.com/dog_rates/status/703769065844768768/photo/1",,2016-02-28,02:29:55,,3406,1199,10.0,10.0,100.0
703631701117943808,iPhone Twitter,This is Bella. Based on this picture she's at least 8ft tall (wow)! Must be rare. 11/10 would pet on tippy toes https://t.co/XTVbSRdvcp,"https://twitter.com/dog_rates/status/703631701117943808/photo/1,https://twitter.com/dog_rates/status/703631701117943808/photo/1,https://twitter.com/dog_rates/status/703631701117943808/photo/1,https://twitter.com/dog_rates/status/703631701117943808/photo/1",Bella,2016-02-27,17:24:05,,2697,722,11.0,10.0,110.00000000000001
703611486317502464,iPhone Twitter,Meet Scooter. He's experiencing the pupper equivalent of dropping ur phone in a toilet 10/10 put it in some rice pup https://t.co/JSmX1FIEaW,https://twitter.com/dog_rates/status/703611486317502464/photo/1,Scooter,2016-02-27,16:03:45,pupper,4004,1591,10.0,10.0,100.0
703407252292673536,iPhone Twitter,This pupper doesn't understand gates. 10/10 so close https://t.co/GUbFF4o6dZ,https://twitter.com/dog_rates/status/703407252292673536/photo/1,,2016-02-27,02:32:12,pupper,2543,732,10.0,10.0,100.0
703268521220972544,iPhone Twitter,Happy Friday here's a sleepy pupper 12/10 https://t.co/eBcqv9SPkY,https://twitter.com/dog_rates/status/703268521220972544/photo/1,,2016-02-26,17:20:56,pupper,2040,570,12.0,10.0,120.0
703079050210877440,iPhone Twitter,This is a Butternut Cumberfloof. It's not windy they just look like that. 11/10 back at it again with the red socks https://t.co/hMjzhdUHaW,"https://twitter.com/dog_rates/status/703079050210877440/photo/1,https://twitter.com/dog_rates/status/703079050210877440/photo/1",,2016-02-26,04:48:02,,7683,3264,11.0,10.0,110.00000000000001
703041949650034688,iPhone Twitter,This is an East African Chalupa Seal. We only rate dogs. Please only send in dogs. Thank you... 10/10 https://t.co/iHe6liLwWR,https://twitter.com/dog_rates/status/703041949650034688/photo/1,,2016-02-26,02:20:37,,27354,13208,10.0,10.0,100.0
702932127499816960,iPhone Twitter,This is Chip. He's an Upper West Nile Pantaloon. Extremely deadly. Will rip your throat out. 6/10 might still pet https://t.co/LUFnwzznaV,https://twitter.com/dog_rates/status/702932127499816960/photo/1,Chip,2016-02-25,19:04:13,,2690,759,6.0,10.0,60.0
702684942141153280,iPhone Twitter,This is Lucy. She's sick of these bullshit generalizations 11/10 https://t.co/d2b5C2R0aO,https://twitter.com/dog_rates/status/702684942141153280/photo/1,Lucy,2016-02-25,02:42:00,,3344,1138,11.0,10.0,110.00000000000001
702671118226825216,iPhone Twitter,Meet Rambo &amp; Kiwi. Rambo's the pup with the sharp toes &amp; rad mohawk. One stays woke while one sleeps. 10/10 for both https://t.co/MpH1Fe9LhZ,https://twitter.com/dog_rates/status/702671118226825216/photo/1,Rambo,2016-02-25,01:47:04,,2284,589,10.0,10.0,100.0
702598099714314240,iPhone Twitter,"This is Sansa. She's gotten too big for her chair. Not so smol anymore. 11/10 once a pupper, always a pupper https://t.co/IpAoztle2s",https://twitter.com/dog_rates/status/702598099714314240/photo/1,Sansa,2016-02-24,20:56:55,pupper,12648,3609,11.0,10.0,110.00000000000001
702332542343577600,TweetDeck,This is Rudy. He's going to be a star. 13/10 talented af (vid by @madalynrossi) https://t.co/Dph4FDGoMd,https://vine.co/v/irlDujgwOjd,Rudy,2016-02-24,03:21:41,,3313,1642,13.0,10.0,130.0
702321140488925184,iPhone Twitter,Please enjoy this picture as much as I did. 12/10 https://t.co/7u8mM99Tj5,"https://twitter.com/dog_rates/status/702321140488925184/photo/1,https://twitter.com/dog_rates/status/702321140488925184/photo/1,https://twitter.com/dog_rates/status/702321140488925184/photo/1,https://twitter.com/dog_rates/status/702321140488925184/photo/1",,2016-02-24,02:36:23,,3406,1087,12.0,10.0,120.0
702276748847800320,iPhone Twitter,"""AND IIIIIIIIIIIEIIIIIIIIIIIII WILL ALWAYS LOVE YOUUUUU"" 11/10 https://t.co/rSNCEiTtfI",https://twitter.com/dog_rates/status/702276748847800320/photo/1,,2016-02-23,23:39:59,,2567,806,11.0,10.0,110.00000000000001
702217446468493312,iPhone Twitter,"I know it's tempting, but please stop sending in pics of Donald Trump. Thank you ...9/10 https://t.co/y35Y1TJERY",https://twitter.com/dog_rates/status/702217446468493312/photo/1,,2016-02-23,19:44:20,,4980,1403,9.0,10.0,90.0
701952816642965504,iPhone Twitter,Meet Rilo. He's a Northern Curly Ticonderoga. Currently balancing on one paw even in strong wind. Acrobatic af 11/10 https://t.co/KInss2PXyX,https://twitter.com/dog_rates/status/701952816642965504/photo/1,Rilo,2016-02-23,02:12:47,,3969,1076,11.0,10.0,110.00000000000001
701601587219795968,iPhone Twitter,This is Coopson. He's a Blingin Schnitzel. Built fence himself. One ear is slightly defective. 10/10 would still pet https://t.co/MWw3pVMhJA,https://twitter.com/dog_rates/status/701601587219795968/photo/1,Coopson,2016-02-22,02:57:08,,2165,480,10.0,10.0,100.0
701214700881756160,iPhone Twitter,"I'm not sure what's happening here, but it's pretty spectacular. 12/10 for both https://t.co/JKXh0NbBNL",https://twitter.com/dog_rates/status/701214700881756160/photo/1,,2016-02-21,01:19:47,,12672,5380,12.0,10.0,120.0
700890391244103680,iPhone Twitter,This is Chet. He's dapper af. His owners want him to learn how to dance but his true passion is potato guns. 11/10 https://t.co/TBv7Qh1zxZ,https://twitter.com/dog_rates/status/700890391244103680/photo/1,Chet,2016-02-20,03:51:05,,2296,603,11.0,10.0,110.00000000000001
700847567345688576,iPhone Twitter,Meet Crouton. He's a Galapagos Boonwiddle. Has a legendary tongue (most Boonwiddles do). Excellent stuff 10/10 https://t.co/110Eeg7KW3,https://twitter.com/dog_rates/status/700847567345688576/photo/1,Crouton,2016-02-20,01:00:55,,2522,526,10.0,10.0,100.0
